book,author,url,excerpt
The Prophet,Kahlil Gibran,https://www.gutenberg.org/files/58585/58585-h/58585-h.htm,"But the hunter was also the hunted; For many of my arrows left my bow only to seek my own breast. And the flier was also the creeper; For when my wings were spread in the sun their shadow upon the earth was a turtle. And I the believer was also the doubter; 102For often have I put my finger in my own wound that I might have the greater belief in you and the greater knowledge of you. And it is with this belief and this knowledge that I say, You are not enclosed within your bodies, nor confined to houses or fields."
Little Women,Louisa May Alcott,https://www.gutenberg.org/files/514/514-h/514-h.htm,"""I know Meg would wet-blanket such a proposal, but I thought you had more spirit,"" began Laurie insinuatingly. ""Bad boy, be quiet! Sit down and think of your own sins, don't go making me add to mine. If I get your grandpa to apologize for the shaking, will you give up running away?"" asked Jo seriously. ""Yes, but you won't do it,"" answered Laurie, who wished to make up, but felt that his outraged dignity must be appeased first. ""If I can manage the young one, I can the old one,"" muttered Jo, as she walked away, leaving Laurie bent over a railroad map with his head propped up on both hands."
Peter Pan,J. M. Barrie,https://www.gutenberg.org/files/16/16-h/16-h.htm,"Up and down they went, and round and round. Heavenly was Wendy’s word. “I say,” cried John, “why shouldn’t we all go out?” Of course it was to this that Peter had been luring them. Michael was ready: he wanted to see how long it took him to do a billion miles. But Wendy hesitated. “Mermaids!” said Peter again. “Oo!” “And there are pirates.” “Pirates,” cried John, seizing his Sunday hat, “let us go at once.” It was just at this moment that Mr. and Mrs. Darling hurried with Nana out of 27. They ran into the middle of the street to look up at the nursery window; and, yes, it was still shut, but the room was ablaze with light, and most heart-gripping sight of all, they could see in shadow on the curtain three little figures in night attire circling round and round, not on the floor but in the air."
Anne of Green Gables,L. M. Montgomery,https://www.gutenberg.org/files/45/45-h/45-h.htm,"“Well, it needn’t prey any longer. I’ll bake you a basket.” “Oh, you dear good Marilla. Oh, you are so kind to me. Oh, I’m so much obliged to you.” Getting through with her “ohs” Anne cast herself into Marilla’s arms and rapturously kissed her sallow cheek. It was the first time in her whole life that childish lips had voluntarily touched Marilla’s face. Again that sudden sensation of startling sweetness thrilled her. She was secretly vastly pleased at Anne’s impulsive caress, which was probably the reason why she said brusquely: “There, there, never mind your kissing nonsense. I’d sooner see you doing strictly as you’re told."
"The Happy Prince, and Other Tales",Oscar Wilde,https://www.gutenberg.org/ebooks/902.html.images,"So they piled the faggots together, and put the Rocket on top, and lit the fire. “This is magnificent,” cried the Rocket, “they are going to let me off in broad day-light, so that every one can see me.” “We will go to sleep now,” they said, “and when we wake up the kettle will be boiled”; and they lay down on the grass, and shut their eyes. The Rocket was very damp, so he took a long time to burn. At last, however, the fire caught him. “Now I am going off!” he cried, and he made himself very stiff and straight."
The Importance of Being Earnest: A Trivial Comedy for Serious People,Oscar Wilde,https://www.gutenberg.org/files/844/844-h/844-h.htm,"Memory, my dear Cecily, is the diary that we all carry about with us. Yes, but it usually chronicles the things that have never happened, and couldn’t possibly have happened. I believe that Memory is responsible for nearly all the three-volume novels that Mudie sends us. Do not speak slightingly of the three-volume novel, Cecily. I wrote one myself in earlier days. Did you really, Miss Prism? How wonderfully clever you are! I hope it did not end happily? I don’t like novels that end happily. They depress me so much. The good ended happily, and the bad unhappily. That is what Fiction means."
The Souls of Black Folk,W. E. B. Du Bois,https://www.gutenberg.org/files/408/408-h/408-h.htm,"Dim face of Beauty haunting all the world, Fair face of Beauty all too fair to see, Where the lost stars adown the heavens are hurled,— There, there alone for thee May white peace be. Beauty, sad face of Beauty, Mystery, Wonder, What are these dreams to foolish babbling men Who cry with little noises ’neath the thunder Of Ages ground to sand, To a little sand. It was out in the country, far from home, far from my foster home, on a dark Sunday night. The road wandered from our rambling log-house up the stony bed of a creek, past wheat and corn, until we could hear dimly across the fields a rhythmic cadence of song,—soft, thrilling, powerful, that swelled and died sorrowfully in our ears."
The American Diary of a Japanese Girl,Yoné Noguchi,https://www.gutenberg.org/ebooks/63256.html.images,"You drop into the toilet room, for instance. You cannot help exclaiming: “Iya, haya, Japan is three centuries behind!” Everything presents to you a silent lecture of scientific modernism. Whenever I am bothered too much by my uncle I lock myself up in the toilet room. There I feel the whole world is mine. I can take off my shoes. I can play acrobat if I prefer. Nobody can spy me. It is the place where you can pray or cry all you desire without one interruption. My room is great, equipped with every new invention. Numbers of electric globes dazzle with kingly light above my head."
"Narrative of the Life of Frederick Douglass, an American Slave",Douglass,https://www.gutenberg.org/files/23/23-h/23-h.htm,"I did not, when a slave, understand the deep meaning of those rude and apparently incoherent songs. I was myself within the circle; so that I neither saw nor heard as those without might see and hear. They told a tale of woe which was then altogether beyond my feeble comprehension; they were tones loud, long, and deep; they breathed the prayer and complaint of souls boiling over with the bitterest anguish. Every tone was a testimony against slavery, and a prayer to God for deliverance from chains. The hearing of those wild notes always depressed my spirit, and filled me with ineffable sadness."
A Study in Scarlet,Arthur Conan Doyle,https://www.gutenberg.org/files/244/244-h/244-h.htm,"His eyes fairly glittered as he spoke, and he put his hand over his heart and bowed as if to some applauding crowd conjured up by his imagination. “You are to be congratulated,” I remarked, considerably surprised at his enthusiasm. “There was the case of Von Bischoff at Frankfort last year. He would certainly have been hung had this test been in existence. Then there was Mason of Bradford, and the notorious Muller, and Lefevre of Montpellier, and Samson of New Orleans. I could name a score of cases in which it would have been decisive.” “You seem to be a walking calendar of crime,” said Stamford with a laugh."
The War of the Worlds,H. G. Wells,https://www.gutenberg.org/files/36/36-h/36-h.htm,"If I had fully realised the meaning of all the things I had seen I should have immediately worked my way round through Byfleet to Street Cobham, and so gone back to rejoin my wife at Leatherhead. But that night the strangeness of things about me, and my physical wretchedness, prevented me, for I was bruised, weary, wet to the skin, deafened and blinded by the storm. I had a vague idea of going on to my own house, and that was as much motive as I had. I staggered through the trees, fell into a ditch and bruised my knees against a plank, and finally splashed out into the lane that ran down from the College Arms. I say splashed, for the storm water was sweeping the sand down the hill in a muddy torrent."
Don Quixote,Miguel de Cervantes Saavedra,https://www.gutenberg.org/files/996/996-h/996-h.htm,"The canon was astonished at the methodical nonsense (if nonsense be capable of method) that Don Quixote uttered, at the way in which he had described the adventure of the knight of the lake, at the impression that the deliberate lies of the books he read had made upon him, and lastly he marvelled at the simplicity of Sancho, who desired so eagerly to obtain the county his master had promised him. By this time the canon’s servants, who had gone to the inn to fetch the sumpter mule, had returned, and making a carpet and the green grass of the meadow serve as a table, they seated themselves in the shade of some trees and made their repast there, that the carter might not be deprived of the advantage of the spot, as has been already said."
The Hound of the Baskervilles,Arthur Conan Doyle,https://www.gutenberg.org/files/2852/2852-h/2852-h.htm,"“And when?” “At the end of the week.” “On the whole,” said Holmes, “I think that your decision is a wise one. I have ample evidence that you are being dogged in London, and amid the millions of this great city it is difficult to discover who these people are or what their object can be. If their intentions are evil they might do you a mischief, and we should be powerless to prevent it. You did not know, Dr. Mortimer, that you were followed this morning from my house?” Dr. Mortimer started violently. “Followed! By whom?” “That, unfortunately, is what I cannot tell you."
"The Awakening, and Selected Short Stories",Kate Chopin,https://www.gutenberg.org/files/160/160-h/160-h.htm,"“What do you mean by the courageous soul?” “Courageous, ma foi! The brave soul. The soul that dares and defies.” “Show me the letter and play for me the Impromptu. You see that I have persistence. Does that quality count for anything in art?” “It counts with a foolish old woman whom you have captivated,” replied Mademoiselle, with her wriggling laugh. The letter was right there at hand in the drawer of the little table upon which Edna had just placed her coffee cup. Mademoiselle opened the drawer and drew forth the letter, the topmost one. She placed it in Edna’s hands, and without further comment arose and went to the piano."
The Romance of Lust: A classic Victorian erotic novel,Anonymous,https://www.gutenberg.org/files/30254/30254-h/30254-h.htm,"“‘Oh! the bad girl, to tell tales out of school.’ “‘Never mind, mamma, I must suck it while you play with mine.’ “She gave a scream—though not very loud—and covered her eyes with her hand. I scrambled off her. The doctor, with great politeness, begged her pardon for his intrusion, but hearing what appeared to him an unearthly noise, he had feared she was taken ill. “Here the usual resource of woman—tears—fell plentifully from mamma. The doctor most affectionately begged her to calm herself. “‘My dear madam,’ said he. do not in any way blame you for this. I am a man of the world, and I know that incest is practised to a far greater extent than is at all imagined, and to prove that it in no way offends me, I may at once tell you that it was my own mother who initiated me into these delightful mysteries."
Wuthering Heights,Emily Brontë,https://www.gutenberg.org/files/768/768-h/768-h.htm,"“I see no reason that he should not know, as well as you,” I returned; “and if you are his choice, he’ll be the most unfortunate creature that ever was born! As soon as you become Mrs. Linton, he loses friend, and love, and all! Have you considered how you’ll bear the separation, and how he’ll bear to be quite deserted in the world? Because, Miss Catherine—” “He quite deserted! we separated!” she exclaimed, with an accent of indignation. “Who is to separate us, pray? They’ll meet the fate of Milo! Not as long as I live, Ellen: for no mortal creature."
Treasure Island,Robert Louis Stevenson,https://www.gutenberg.org/files/120/120-h/120-h.htm,"rode hard all the way till we drew up before Dr. Livesey’s door. The house was all dark to the front. Mr. Dance told me to jump down and knock, and Dogger gave me a stirrup to descend by. The door was opened almost at once by the maid. “Is Dr. Livesey in?” I asked. No, she said, he had come home in the afternoon but had gone up to the hall to dine and pass the evening with the squire. “So there we go, boys,” said Mr. Dance. This time, as the distance was short, I did not mount, but ran with Dogger’s stirrup-leather to the lodge gates and up the long, leafless, moonlit avenue to where the white line of the hall buildings looked on either hand on great old gardens."
Leviathan,Thomas Hobbes,https://www.gutenberg.org/files/3207/3207-h/3207-h.htm,"The unformed matter of the World, was a God, by the name of Chaos. The Heaven, the Ocean, the Planets, the Fire, the Earth, the Winds, were so many Gods. From the propagation of Religion, it is not hard to understand the causes of the resolution of the same into its first seeds, or principles; which are only an opinion of a Deity, and Powers invisible, and supernaturall; that can never be so abolished out of humane nature, but that new Religions may againe be made to spring out of them, by the culture of such men, as for such purpose are in reputation."
The Kama Sutra of Vatsyayana,Vatsyayana,https://www.gutenberg.org/files/27827/27827-h/27827-h.htm,"Middling nails, which contain the properties of both the above kinds, belong to the people of the Maharashtra. (1). When a person presses the chin, the breasts, the lower lip, or the jaghana of another so softly that no scratch or mark is left, but only the hair on the body becomes erect from the touch of the nails, and the nails themselves make a sound, it is called a ""sounding or pressing with the nails."" This pressing is used in the case of a young girl when her lover shampoos her, scratches her head, and wants to trouble or frighten her."
Narrative of the Captivity and Restoration of Mrs. Mary Rowlandson,Rowlandson,https://www.gutenberg.org/files/851/851-h/851-h.htm,"On the tenth of February 1675, came the Indians with great numbers upon Lancaster: their first coming was about sunrising; hearing the noise of some guns, we looked out; several houses were burning, and the smoke ascending to heaven. There were five persons taken in one house; the father, and the mother and a sucking child, they knocked on the head; the other two they took and carried away alive. There were two others, who being out of their garrison upon some occasion were set upon; one was knocked on the head, the other escaped; another there was who running along was shot and wounded, and fell down; he begged of them his life, promising them money (as they told me) but they would not hearken to him but knocked him in head, and stripped him naked, and split open his bowels."
Second Treatise of Government,John Locke,https://www.gutenberg.org/ebooks/7370.html.images,"Sect. 135. Though the legislative, whether placed in one or more, whether it be always in being, or only by intervals, though it be the supreme power in every commonwealth; yet: First, It is not, nor can possibly be absolutely arbitrary over the lives and fortunes of the people: for it being but the joint power of every member of the society given up to that person, or assembly, which is legislator; it can be no more than those persons had in a state of nature before they entered into society, and gave up to the community: for no body can transfer to another more power than he has in himself; and no body has an absolute arbitrary power over himself, or over any other, to destroy his own life, or take away the life or property of another."
Emma,Jane Austen,https://www.gutenberg.org/files/158/158-h/158-h.htm,"Emma looked graciously. “Such a fortnight as it has been!” he continued; “every day more precious and more delightful than the day before!—every day making me less fit to bear any other place. Happy those, who can remain at Highbury!” “As you do us such ample justice now,” said Emma, laughing, “I will venture to ask, whether you did not come a little doubtfully at first? Do not we rather surpass your expectations? I am sure we do. I am sure you did not much expect to like us. You would not have been so long in coming, if you had had a pleasant idea of Highbury.”"
The Time Machine,H. G. Wells,https://www.gutenberg.org/files/35/35-h/35-h.htm,"The Time Traveller smiled round at us. Then, still smiling faintly, and with his hands deep in his trousers pockets, he walked slowly out of the room, and we heard his slippers shuffling down the long passage to his laboratory. The Psychologist looked at us. “I wonder what he’s got?” “Some sleight-of-hand trick or other,” said the Medical Man, and Filby tried to tell us about a conjuror he had seen at Burslem, but before he had finished his preface the Time Traveller came back, and Filby’s anecdote collapsed. The thing the Time Traveller held in his hand was a glittering metallic framework, scarcely larger than a small clock, and very delicately made."
Les Misérables,Victor Hugo,https://www.gutenberg.org/files/135/135-h/135-h.htm,"He made haste to improvise an expedient to make her forget the oath. “I will put earth in the coffin, reverend Mother. That will produce the effect of a corpse.” “You are right. Earth, that is the same thing as man. So you will manage the empty coffin?” “I will make that my special business.” The prioress’s face, up to that moment troubled and clouded, grew serene once more. She made the sign of a superior dismissing an inferior to him. Fauchelevent went towards the door. As he was on the point of passing out, the prioress raised her voice gently:—"
Dubliners,James Joyce,https://www.gutenberg.org/files/2814/2814-h/2814-h.htm,"The hall-door was closed; and Aunt Kate, Aunt Julia and Mary Jane came down the hall, still laughing. “Well, isn’t Freddy terrible?” said Mary Jane. “He’s really terrible.” Gabriel said nothing but pointed up the stairs towards where his wife was standing. Now that the hall-door was closed the voice and the piano could be heard more clearly. Gabriel held up his hand for them to be silent. The song seemed to be in the old Irish tonality and the singer seemed uncertain both of his words and of his voice. The voice, made plaintive by distance and by the singer’s hoarseness, faintly illuminated the cadence of the air with words expressing grief:"
The Call of the Wild,Jack London,https://www.gutenberg.org/files/215/215-h/215-h.htm,"But the team did not get up at the command. It had long since passed into the stage where blows were required to rouse it. The whip flashed out, here and there, on its merciless errands. John Thornton compressed his lips. Sol-leks was the first to crawl to his feet. Teek followed. Joe came next, yelping with pain. Pike made painful efforts. Twice he fell over, when half up, and on the third attempt managed to rise. Buck made no effort. He lay quietly where he had fallen. The lash bit into him again and again, but he neither whined nor struggled."
Autobiography of Benjamin Franklin,Benjamin Franklin,https://www.gutenberg.org/files/20203/20203-h/20203-h.htm,"The first members were Joseph Breintnal, a copyer of deeds for the scriveners, a good-natur'd, friendly middle-ag'd man, a great lover of poetry, reading all he could meet with, and writing some that was tolerable; very ingenious in many little Nicknackeries, and of sensible conversation. Thomas Godfrey, a self-taught mathematician, great in his way, and afterward inventor of what is now called Hadley's Quadrant. But he knew little out of his way, and was not a pleasing companion; as, like most great mathematicians I have met with, he expected universal precision in everything said, or was forever denying or distinguishing upon trifles, to the disturbance of all conversation."
Uncle Tom's Cabin,Harriet Beecher Stowe,https://www.gutenberg.org/files/203/203-h/203-h.htm,"And now Rachel took Eliza’s hand kindly, and led the way to the supper-table. As they were sitting down, a light tap sounded at the door, and Ruth entered. “I just ran in,” she said, “with these little stockings for the boy,—three pair, nice, warm woollen ones. It will be so cold, thee knows, in Canada. Does thee keep up good courage, Eliza?” she added, tripping round to Eliza’s side of the table, and shaking her warmly by the hand, and slipping a seed-cake into Harry’s hand. “I brought a little parcel of these for him,” she said, tugging at her pocket to get out the package."
The Brothers Karamazov,Fyodor Dostoyevsky,https://www.gutenberg.org/files/28054/28054-h/28054-h.htm,"“Well, tell me where to begin, give your orders. The existence of God, eh?” “Begin where you like. You declared yesterday at father’s that there was no God.” Alyosha looked searchingly at his brother. “I said that yesterday at dinner on purpose to tease you and I saw your eyes glow. But now I’ve no objection to discussing with you, and I say so very seriously. I want to be friends with you, Alyosha, for I have no friends and want to try it. Well, only fancy, perhaps I too accept God,” laughed Ivan; “that’s a surprise for you, isn’t it?”"
"The Interesting Narrative of the Life of Olaudah Equiano, Or Gustavus Vassa, The",,https://www.gutenberg.org/ebooks/15399.html.images,"Though we had no places of public worship, we had priests and magicians, or wise men. I do not remember whether they had different offices, or whether they were united in the same persons, but they were held in great reverence by the people. They calculated our time, and foretold events, as their name imported, for we called them Ah-affoe-way-cah, which signifies calculators or yearly men, our year being called Ah-affoe. They wore their beards, and when they died they were succeeded by their sons. Most of their implements and things of value were interred along with them. Pipes and tobacco were also put into the grave with the corpse, which was always perfumed and ornamented, and animals were offered in sacrifice to them."
The Legend of Sleepy Hollow,Washington Irving,https://www.gutenberg.org/files/41/41-h/41-h.htm,"The small birds were taking their farewell banquets. In the fullness of their revelry, they fluttered, chirping and frolicking from bush to bush, and tree to tree, capricious from the very profusion and variety around them. There was the honest cock robin, the favorite game of stripling sportsmen, with its loud querulous note; and the twittering blackbirds flying in sable clouds; and the golden-winged woodpecker with his crimson crest, his broad black gorget, and splendid plumage; and the cedar bird, with its red-tipt wings and yellow-tipt tail and its little monteiro cap of feathers; and the blue jay, that noisy coxcomb, in his gay light blue coat and white underclothes, screaming and chattering, nodding and bobbing and bowing, and pretending to be on good terms with every songster of the grove."
The Secret Garden,Frances Hodgson Burnett,https://www.gutenberg.org/files/113/113-h/113-h.htm,"“I don’t suppose I shall,” he answered as indifferently as he had spoken before. “Ever since I remember anything I have heard people say I shan’t. At first they thought I was too little to understand and now they think I don’t hear. But I do. My doctor is my father’s cousin. He is quite poor and if I die he will have all Misselthwaite when my father is dead. I should think he wouldn’t want me to live.” “Do you want to live?” inquired Mary. “No,” he answered, in a cross, tired fashion. “But I don’t want to die. When I feel ill I lie here and think about it until I cry and cry.”"
The Jungle Book,Rudyard Kipling,https://www.gutenberg.org/files/236/236-h/236-h.htm,"“Oh, go on,” said Billy. “Please don’t mind me. I suppose you fellows fight standing on your tails?” “Only one way,” said the two together. (They must have been twins.) “This is that way. To put all twenty yoke of us to the big gun as soon as Two Tails trumpets.” (“Two Tails” is camp slang for the elephant.) “What does Two Tails trumpet for?” said the young mule. “To show that he is not going any nearer to the smoke on the other side. Two Tails is a great coward. Then we tug the big gun all together—Heya—Hullah! Heeyah! Hullah! We do not climb like cats nor run like calves."
"The Extraordinary Adventures of Arsene Lupin, Gentleman-Burglar",Maurice Leblanc,https://www.gutenberg.org/files/6133/6133-h/6133-h.htm,"He wandered through one path after another, and sometimes retraced his steps. What was he seeking? Had he any definite object? At the end of an hour, he appeared to be faint from fatigue, and, noticing a bench, he sat down. The spot, not far from Auteuil, on the edge of a pond hidden amongst the trees, was absolutely deserted. After the lapse of another half-hour, Ganimard became impatient and resolved to speak to the man. He approached and took a seat beside Baudru, lighted a cigarette, traced some figures in the sand with the end of his cane, and said:"
