book,author,url,excerpt
Pride and Prejudice,Jane Austen,https://www.gutenberg.org/files/1342/1342-h/1342-h.htm,"“You are a very strange creature by way of a friend!—always wanting me to play and sing before anybody and everybody! If my vanity had taken a musical turn, you would have been invaluable; but as it is, I would really rather not sit down before those who must be in the habit of hearing the very best performers.” On Miss Lucas’s persevering, however, she added, “Very well; if it must be so, it must.” And gravely glancing at Mr. Darcy, “There is a fine old saying, which everybody here is of course familiar with—‘Keep your breath to cool your porridge,’—and I shall keep mine to swell my song.”"
"Frankenstein; Or, The Modern Prometheus",Mary Wollstonecraft Shelley,https://www.gutenberg.org/files/84/84-h/84-h.htm,"In the mean time I worked on, and my labour was already considerably advanced. I looked towards its completion with a tremulous and eager hope, which I dared not trust myself to question but which was intermixed with obscure forebodings of evil that made my heart sicken in my bosom. I sat one evening in my laboratory; the sun had set, and the moon was just rising from the sea; I had not sufficient light for my employment, and I remained idle, in a pause of consideration of whether I should leave my labour for the night or hasten its conclusion by an unremitting attention to it."
Alice's Adventures in Wonderland,Lewis Carroll,https://www.gutenberg.org/files/11/11-h/11-h.htm,"“Well, I should like to be a little larger, sir, if you wouldn’t mind,” said Alice: “three inches is such a wretched height to be.” “It is a very good height indeed!” said the Caterpillar angrily, rearing itself upright as it spoke (it was exactly three inches high). “But I’m not used to it!” pleaded poor Alice in a piteous tone. And she thought of herself, “I wish the creatures wouldn’t be so easily offended!” “You’ll get used to it in time,” said the Caterpillar; and it put the hookah into its mouth and began smoking again. This time Alice waited patiently until it chose to speak again."
The Adventures of Sherlock Holmes,Arthur Conan Doyle,https://www.gutenberg.org/files/1661/1661-h/1661-h.htm,"“My uncle Elias emigrated to America when he was a young man and became a planter in Florida, where he was reported to have done very well. At the time of the war he fought in Jackson’s army, and afterwards under Hood, where he rose to be a colonel. When Lee laid down his arms my uncle returned to his plantation, where he remained for three or four years. About 1869 or 1870 he came back to Europe and took a small estate in Sussex, near Horsham. He had made a very considerable fortune in the States, and his reason for leaving them was his aversion to the negroes, and his dislike of the Republican policy in extending the franchise to them."
"Moby Dick; Or, The Whale",Herman Melville,https://www.gutenberg.org/files/2701/2701-h/2701-h.htm,"Steering as she had done, the wind had been somewhat on the Pequod’s quarter, so that now being pointed in the reverse direction, the braced ship sailed hard upon the breeze as she rechurned the cream in her own white wake. “Against the wind he now steers for the open jaw,” murmured Starbuck to himself, as he coiled the new-hauled main-brace upon the rail. “God keep us, but already my bones feel damp within me, and from the inside wet my flesh. I misdoubt me that I disobey my God in obeying him!” “Stand by to sway me up!” cried Ahab, advancing to the hempen basket."
The Prince,Niccolò Machiavelli,https://www.gutenberg.org/files/1232/1232-h/1232-h.htm,"And there is nothing wastes so rapidly as liberality, for even whilst you exercise it you lose the power to do so, and so become either poor or despised, or else, in avoiding poverty, rapacious and hated. And a prince should guard himself, above all things, against being despised and hated; and liberality leads you to both. Therefore it is wiser to have a reputation for meanness which brings reproach without hatred, than to be compelled through seeking a reputation for liberality to incur a name for rapacity which begets reproach with hatred. And of all princes, it is impossible for the new prince to avoid the imputation of cruelty, owing to new states being full of dangers."
Beowulf: An Anglo-Saxon Epic Poem,J. Lesslie Hall,https://www.gutenberg.org/ebooks/16328.html.images,"’Mid the jewels he found then the famous old chieftain, His liegelord belovèd, at his life’s-end gory: He thereupon ’gan to lave him with water, Till the point of his word piercèd his breast-hoard. Beowulf spake (the gold-gems he noticed), The old one in sorrow: “For the jewels I look on Thanks do I utter for all to the Ruler, Wielder of Worship, with words of devotion, The Lord everlasting, that He let me such treasures Gain for my people ere death overtook me. Since I’ve bartered the agèd life to me granted For treasure of jewels, attend ye henceforward"
The Picture of Dorian Gray,Oscar Wilde,https://www.gutenberg.org/files/174/174-h/174-h.htm,"“On the wharf?” “Yes.” “That mad-cat is sure to be there. They won’t have her in this place now.” Dorian shrugged his shoulders. “I am sick of women who love one. Women who hate one are much more interesting. Besides, the stuff is better.” “Much the same.” “I like it better. Come and have something to drink. I must have something.” “I don’t want anything,” murmured the young man. “Never mind.” Adrian Singleton rose up wearily and followed Dorian to the bar. A half-caste, in a ragged turban and a shabby ulster, grinned a hideous greeting as he thrust a bottle of brandy and two tumblers in front of them."
A Tale of Two Cities,Charles Dickens,https://www.gutenberg.org/files/98/98-h/98-h.htm,"In a quarter of an hour Monseigneur was ready, and sat down alone to his sumptuous and choice supper. His chair was opposite to the window, and he had taken his soup, and was raising his glass of Bordeaux to his lips, when he put it down. “What is that?” he calmly asked, looking with attention at the horizontal lines of black and stone colour. “Monseigneur? That?” “Outside the blinds. Open the blinds.” It was done. “Well?” “Monseigneur, it is nothing. The trees and the night are all that are here.” The servant who spoke, had thrown the blinds wide, had looked out into the vacant darkness, and stood with that blank behind him, looking round for instructions."
The Great Gatsby,F. Scott Fitzgerald,https://www.gutenberg.org/ebooks/64317.html.images,"“How do you get to West Egg village?” he asked helplessly. I told him. And as I walked on I was lonely no longer. I was a guide, a pathfinder, an original settler. He had casually conferred on me the freedom of the neighbourhood. And so with the sunshine and the great bursts of leaves growing on the trees, just as things grow in fast movies, I had that familiar conviction that life was beginning over again with the summer. Across the courtesy bay the white palaces of fashionable East Egg glittered along the water, and the history of the summer really begins on the evening I drove over there to have dinner with the Tom Buchanans. Daisy was my second cousin once removed, and I’d known Tom in college."
The Scarlet Letter,Nathaniel Hawthorne,https://www.gutenberg.org/files/25344/25344-h/25344-h.htm,"“It were far worse than death!” replied the minister. “But how to avoid it? What choice remains to me? Shall I lie down again on these withered leaves, where I cast myself when thou didst tell me what he was? Must I sink down there, and die at once?” “Alas, what a ruin has befallen thee!” said Hester, with the tears gushing into her eyes. “Wilt thou die for very weakness? There is no other cause!” “The judgment of God is on me,” answered the conscience-stricken priest. “It is too mighty for me to struggle with!” “Be thou strong for me!” answered he."
Metamorphosis,Franz Kafka,https://www.gutenberg.org/files/5200/5200-h/5200-h.htm,"For the first fourteen days, Gregor’s parents could not bring themselves to come into the room to see him. He would often hear them say how they appreciated all the new work his sister was doing even though, before, they had seen her as a girl who was somewhat useless and frequently been annoyed with her. But now the two of them, father and mother, would often both wait outside the door of Gregor’s room while his sister tidied up in there, and as soon as she went out again she would have to tell them exactly how everything looked, what Gregor had eaten, how he had behaved this time and whether, perhaps, any slight improvement could be seen."
The Yellow Wallpaper,Charlotte Perkins Gilman,https://www.gutenberg.org/files/1952/1952-h/1952-h.htm,"Of course it is only nervousness. It does weigh on me so not to do my duty in any way! I meant to be such a help to John, such a real rest and comfort, and here I am a comparative burden already! Nobody would believe what an effort it is to do what little I am able—to dress and entertain, and order things. It is fortunate Mary is so good with the baby. Such a dear baby! And yet I cannot be with him, it makes me so nervous. I suppose John never was nervous in his life. He laughs at me so about this wallpaper!"
Dracula,Bram Stoker,https://www.gutenberg.org/files/345/345-h/345-h.htm,"Later.—It took all my courage to say good-bye to my darling. We may never meet again. Courage, Mina! the Professor is looking at you keenly; his look is a warning. There must be no tears now—unless it may be that God will let them fall in gladness. Jonathan Harker’s Journal. It is a wild adventure we are on. Here, as we are rushing along through the darkness, with the cold from the river seeming to rise up and strike us; with all the mysterious voices of the night around us, it all comes home. We seem to be drifting into unknown places and unknown ways; into a whole world of dark and dreadful things."
Grimms' Fairy Tales,Jacob Grimm and Wilhelm Grimm,https://www.gutenberg.org/files/2591/2591-h/2591-h.htm,"Then the prince thanked his little friend with the scarlet cloak for his friendly aid, and took the wand and the bread, and went travelling on and on, over sea and over land, till he came to his journey’s end, and found everything to be as the dwarf had told him. The door flew open at the third stroke of the wand, and when the lions were quieted he went on through the castle and came at length to a beautiful hall. Around it he saw several knights sitting in a trance; then he pulled off their rings and put them on his own fingers."
A Doll's House : a play,Henrik Ibsen,https://www.gutenberg.org/files/2542/2542-h/2542-h.htm,"But Krogstad did nothing of that sort; he got himself out of it by a cunning trick, and that is why he has gone under altogether. But do you think it would—? How? Because such an atmosphere of lies infects and poisons the whole life of a home. Each breath the children take in such a house is full of the germs of evil. My dear, I have often seen it in the course of my life as a lawyer. Almost everyone who has gone to the bad early in life has had a deceitful mother."
The Iliad,Homer,https://www.gutenberg.org/files/6130/6130-h/6130-h.htm,"Dryden’s Virgil ii. 408. —From mortal mists. “Paradise Lost,” xi. 411. —The race of those. Dryden’s Virgil, vii. 386, sqq. The belief in the existence of men of larger stature in earlier times, is by no means confined to Homer. —Such stream, i.e. the ichor, or blood of the gods. “Paradise Lost,” vi. 339. This was during the wars with the Titans. —Amphitryon’s son, Hercules, born to Jove by Alcmena, the wife of Amphitryon. —Ægiale daughter of Adrastus. The Cyclic poets (See Anthon’s Lempriere, s. v.) assert Venus incited her to infidelity, in revenge for the wound she had received from her husband."
Jane Eyre: An Autobiography,Charlotte Brontë,https://www.gutenberg.org/files/1260/1260-h/1260-h.htm,"“You may look at it,” replied the girl, offering me the book. “Can you tell me what the writing on that stone over the door means? What is Lowood Institution?” “This house where you are come to live.” “And why do they call it Institution? Is it in any way different from other schools?” “Both died before I can remember.” “Well, all the girls here have lost either one or both parents, and this is called an institution for educating orphans.” “Do we pay no money? Do they keep us for nothing?” “We pay, or our friends pay, fifteen pounds a year for each.”"
"Walden, and On The Duty Of Civil Disobedience",Henry David Thoreau,https://www.gutenberg.org/files/205/205-h/205-h.htm,"A true friend of man; almost the only friend of human progress. An Old Mortality, say rather an Immortality, with unwearied patience and faith making plain the image engraven in men’s bodies, the God of whom they are but defaced and leaning monuments. With his hospitable intellect he embraces children, beggars, insane, and scholars, and entertains the thought of all, adding to it commonly some breadth and elegance. I think that he should keep a caravansary on the world’s highway, where philosophers of all nations might put up, and on his sign should be printed, “Entertainment for man, but not for his beast."
A Modest Proposal,Jonathan Swift,https://www.gutenberg.org/files/1080/1080-h/1080-h.htm,"Some persons of a desponding spirit are in great concern about that vast number of poor people, who are aged, diseased, or maimed; and I have been desired to employ my thoughts what course may be taken, to ease the nation of so grievous an incumbrance. But I am not in the least pain upon that matter, because it is very well known, that they are every day dying, and rotting, by cold and famine, and filth, and vermin, as fast as can be reasonably expected. And as to the young labourers, they are now in almost as hopeful a condition."
The Strange Case of Dr. Jekyll and Mr. Hyde,Robert Louis Stevenson,https://www.gutenberg.org/files/43/43-h/43-h.htm,"“By description,” was the reply. “Whose description?” “We have common friends,” said Mr. Utterson. “Common friends,” echoed Mr. Hyde, a little hoarsely. “Who are they?” “Jekyll, for instance,” said the lawyer. “He never told you,” cried Mr. Hyde, with a flush of anger. “I did not think you would have lied.” “Come,” said Mr. Utterson, “that is not fitting language.” The other snarled aloud into a savage laugh; and the next moment, with extraordinary quickness, he had unlocked the door and disappeared into the house. The lawyer stood awhile when Mr. Hyde had left him, the picture of disquietude. Then he began slowly to mount the street, pausing every step or two and putting his hand to his brow like a man in mental perplexity."
War and Peace,graf Leo Tolstoy,https://www.gutenberg.org/files/2600/2600-h/2600-h.htm,"The right thing now was, if not to retire from the service, at any rate to go home on leave. Why he had to go he did not know; but after his after-dinner nap he gave orders to saddle Mars, an extremely vicious gray stallion that had not been ridden for a long time, and when he returned with the horse all in a lather, he informed Lavrúshka (Denísov’s servant who had remained with him) and his comrades who turned up in the evening that he was applying for leave and was going home. Difficult and strange as it was for him to reflect that he would go away without having heard from the staff—and this interested him extremely—whether he was promoted to a captaincy or would receive the Order of St. Anne for the last maneuvers; strange as it was to think that he would go away without having sold his three roans to the Polish Count Golukhovski, who was bargaining for the horses Rostóv had betted he would sell for two thousand rubles; incomprehensible as it seemed that the ball the hussars were giving in honor of the Polish Mademoiselle Przazdziecka (out of rivalry to the Uhlans who had given one in honor of their Polish Mademoiselle Borzozowska) would take place without him—he knew he must go away from this good, bright world to somewhere where everything was stupid and confused."
"The Adventures of Tom Sawyer, Complete",Mark Twain,https://www.gutenberg.org/files/74/74-h/74-h.htm,"“Well, Tom Sawyer he licked me once.” But that bid for glory was a failure. Most of the boys could say that, and so that cheapened the distinction too much. The group loitered away, still recalling memories of the lost heroes, in awed voices. There was a rustle in the gallery, which nobody noticed; a moment later the church door creaked; the minister raised his streaming eyes above his handkerchief, and stood transfixed! First one and then another pair of eyes followed the minister’s, and then almost with one impulse the congregation rose and stared while the three dead boys came marching up the aisle, Tom in the lead, Joe next, and Huck, a ruin of drooping rags, sneaking sheepishly in the rear! They had been hid in the unused gallery listening to their own funeral sermon!"
Anthem,Ayn Rand,https://www.gutenberg.org/files/1250/1250-h/1250-h.htm,"And then we spoke. Our voice was hard and there was no mercy in our voice. We said: “We shall not report our find to the City Council. We shall not report it to any men.” They raised their hands to their ears, for never had they heard such words as these. “International 4-8818,” we asked, “will you report us to the Council and see us lashed to death before your eyes?” They stood straight all of a sudden and they answered: “Rather would we die.” “Then,” we said, “keep silent. This place is ours. This place belongs to us, Equality 7-2521, and to no other men on earth."
A Christmas Carol in Prose; Being a Ghost Story of Christmas,Charles Dickens,https://www.gutenberg.org/files/46/46-h/46-h.htm,"“Are there no prisons?” said the Spirit, turning on him for the last time with his own words. “Are there no workhouses?” The bell struck twelve. Scrooge looked about him for the Ghost, and saw it not. As the last stroke ceased to vibrate, he remembered the prediction of old Jacob Marley, and lifting up his eyes, beheld a solemn Phantom, draped and hooded, coming, like a mist along the ground, towards him. The Phantom slowly, gravely, silently, approached. When it came near him, Scrooge bent down upon his knee; for in the very air through which this Spirit moved it seemed to scatter gloom and mystery."
The Republic,Plato,https://www.gutenberg.org/ebooks/1497.html.images,"What is that? There is a perfection which all knowledge ought to reach, and which our pupils ought also to attain, and not to fall short of, as I was saying that they did in astronomy. For in the science of harmony, as you probably know, the same thing happens. The teachers of harmony compare the sounds and consonances which are heard only, and their labour, like that of the astronomers, is in vain. You mean, I said, those gentlemen who tease and torture the strings and rack them on the pegs of the instrument: I might carry on the metaphor and speak after their manner of the blows which the plectrum gives, and make accusations against the strings, both of backwardness and forwardness to sound; but this would be tedious, and therefore I will only say that these are not the men, and that I am referring to the Pythagoreans, of whom I was just now proposing to enquire about harmony."
Crime and Punishment,Fyodor Dostoyevsky,https://www.gutenberg.org/files/2554/2554-h/2554-h.htm,"“Yes... he was so kind... Dounia, I promised Luzhin I’d throw him downstairs and told him to go to hell....” “Rodya, what are you saying! Surely, you don’t mean to tell us...” Pulcheria Alexandrovna began in alarm, but she stopped, looking at Dounia. Avdotya Romanovna was looking attentively at her brother, waiting for what would come next. Both of them had heard of the quarrel from Nastasya, so far as she had succeeded in understanding and reporting it, and were in painful perplexity and suspense. “Dounia,” Raskolnikov continued with an effort, “I don’t want that marriage, so at the first opportunity to-morrow you must refuse Luzhin, so that we may never hear his name again.”"
Heart of Darkness,Joseph Conrad,https://www.gutenberg.org/files/219/219-h/219-h.htm,"“They swore aloud together—out of sheer fright, I believe—then pretending not to know anything of my existence, turned back to the station. The sun was low; and leaning forward side by side, they seemed to be tugging painfully uphill their two ridiculous shadows of unequal length, that trailed behind them slowly over the tall grass without bending a single blade. “Going up that river was like traveling back to the earliest beginnings of the world, when vegetation rioted on the earth and the big trees were kings. An empty stream, a great silence, an impenetrable forest. The air was warm, thick, heavy, sluggish."
Great Expectations,Charles Dickens,https://www.gutenberg.org/files/1400/1400-h/1400-h.htm,"I took what Joe gave me, and found it to be the crumpled play-bill of a small metropolitan theatre, announcing the first appearance, in that very week, of “the celebrated Provincial Amateur of Roscian renown, whose unique performance in the highest tragic walk of our National Bard has lately occasioned so great a sensation in local dramatic circles.” “Were you at his performance, Joe?” I inquired. “I were,” said Joe, with emphasis and solemnity. “Was there a great sensation?” A ghost-seeing effect in Joe’s own countenance informed me that Herbert had entered the room. So, I presented Joe to Herbert, who held out his hand; but Joe backed from it, and held on by the bird’s-nest."
Adventures of Huckleberry Finn,Mark Twain,https://www.gutenberg.org/files/76/76-h/76-h.htm,"Jim’s eyes bugged out when he heard that; and I reckon mine did, too. Then the baldhead says: “No! you can’t mean it?” Well, that was all easy, so we done it. All through dinner Jim stood around and waited on him, and says, “Will yo’ Grace have some o’ dis or some o’ dat?” and so on, and a body could see it was mighty pleasing to him. But the old man got pretty silent by and by—didn’t have much to say, and didn’t look pretty comfortable over all that petting that was going on around that duke. He seemed to have something on his mind."
The Wonderful Wizard of Oz,L. Frank Baum,https://www.gutenberg.org/files/55/55-h/55-h.htm,"“Or I my courage?” asked the Lion. “Or I my brains?” wailed the Scarecrow, wiping the tears from his eyes with his coat sleeve. “My dear friends,” said Oz, “I pray you not to speak of these little things. Think of me, and the terrible trouble I’m in at being found out.” “Doesn’t anyone else know you’re a humbug?” asked Dorothy. “No one knows it but you four—and myself,” replied Oz. “I have fooled everyone so long that I thought I should never be found out. It was a great mistake my ever letting you into the Throne Room. Usually I will not see even my subjects, and so they believe I am something terrible.”"
"The Count of Monte Cristo, Illustrated",Alexandre Dumas,https://www.gutenberg.org/files/1184/1184-h/1184-h.htm,"“You?” “Yes.” “You have them?” “I have them.” “Ah, indeed?” said the major, who, seeing the object of his journey frustrated by the absence of the papers, feared also that his forgetfulness might give rise to some difficulty concerning the 48,000 francs—“ah, indeed, that is a fortunate circumstance; yes, that really is lucky, for it never occurred to me to bring them.” “I do not at all wonder at it—one cannot think of everything; but, happily, the Abbé Busoni thought for you.” “He is an excellent person.” “He is extremely prudent and thoughtful.” “He is an admirable man,” said the major; “and he sent them to you?”"
Ulysses,James Joyce,https://www.gutenberg.org/files/4300/4300-h/4300-h.htm,"Mr Bloom walked behind the eyeless feet, a flatcut suit of herringbone tweed. Poor young fellow! How on earth did he know that van was there? Must have felt it. See things in their forehead perhaps: kind of sense of volume. Weight or size of it, something blacker than the dark. Wonder would he feel it if something was removed. Feel a gap. Queer idea of Dublin he must have, tapping his way round by the stones. Could he walk in a beeline if he hadn’t that cane? Bloodless pious face like a fellow going in to be a priest."
The Odyssey,Homer,https://www.gutenberg.org/files/1727/1727-h/1727-h.htm,"Meantime the suitors went on board and sailed their ways over the sea, intent on murdering Telemachus. Now there is a rocky islet called Asteris, of no great size, in mid channel between Ithaca and Samos, and there is a harbour on either side of it where a ship can lie. Here then the Achaeans placed themselves in ambush. A And now, as Dawn rose from her couch beside Tithonus—harbinger of light alike to mortals and immortals—the gods met in council and with them, Jove the lord of thunder, who is their king. Thereon Minerva began to tell them of the many sufferings of Ulysses, for she pitied him away there in the house of the nymph Calypso."
